{
  "schema_version": "1.0",
  "task_id": "DEMO-001",
  "project_id": "demo-project",
  "workstream_id": "demo-project:daily-development",
  "parent_task_id": null,
  "title": "为健康检查接口补充回归测试",
  "type": "maintenance",
  "status": "ready",
  "priority": "medium",
  "risk_level": "low",
  "objective": "补充健康检查接口的成功和失败路径测试，并保持现有行为不变。",
  "background": ["该任务用于演示任务生命周期协议。"],
  "scope": {
    "include": ["测试代码", "必要的测试夹具"],
    "exclude": ["生产部署", "接口行为重构"]
  },
  "acceptance_criteria": ["成功路径测试通过", "依赖异常路径测试通过", "原有测试通过"],
  "source": { "type": "manual", "ref": null, "deduplication_key": null },
  "assignee": { "type": "agent", "id": "codex-default" },
  "dependencies": [],
  "blocked_reason": null,
  "cancellation_reason": null,
  "requires_review": true,
  "automation_policy": {
    "auto_dispatch": false,
    "max_runs": 3,
    "timeout_minutes": 60,
    "on_failure": "return_to_ready",
    "on_no_review": "stay_in_review",
    "cost_budget": null
  },
  "artifacts": {
    "handoff": "projects/demo-project/handoffs/DEMO-001.json",
    "feedback": null,
    "branch": null,
    "commits": [],
    "pull_request": null,
    "documents": []
  },
  "runs": [],
  "created_at": "2026-08-04T10:00:00+08:00",
  "updated_at": "2026-08-04T10:00:00+08:00",
  "completed_at": null
}
